{
  "gene_id": "CD-KELTNER-MID-STUCK",
  "category": "range",
  "condition_type": "indicator",
  "expression": "oscillator_keltner_stuck_midband",
  "parameters": {
    "strength_threshold": {
      "value": 0.7,
      "range": {
        "low": 0.3,
        "high": 0.98
      }
    }
  },
  "inverted": false,
  "weight": 1.0,
  "code_ref": {
    "file": "21-特征工程中心/feature_hub/modules/classic_indicators.py",
    "lines": {
      "low": 53,
      "high": 72
    }
  },
  "tags": [
    "range",
    "indicator",
    "KELTNER-MID-STUC"
  ],
  "version": "1.0",
  "notes": "Baseline gene #12 MVP seed (auto-gen reproducible)."
}
